{"capabilities":[{"blocked_by":[],"name":"export_evidence","requires":["manifest_records=verified"],"safe":true}],"contractions":[],"episode_id":2026071902,"evidence":{"manifest_integrity":{"issue_codes":[],"state":"verified"}},"issues":[],"lifecycle":"ended","policy_source":"cpp-typed-fold-fsck","repair_prerequisites":[],"safe_capabilities":["export_evidence"],"schema":"kungfu.episode.qualification/v1","status":"ok"}
